{
  "skill": "parity-judge",
  "status": "fail",
  "inputs": {
    "legacy_root": "outputs/legacy_runs/legacy_case_12",
    "framework_root": "outputs/framework_runs/yolo26n__pgd__c_dog",
    "tolerances": {
      "map50": 0.02,
      "total_detections": 20
    }
  },
  "comparability": {
    "is_comparable": true,
    "issues": []
  },
  "metric_deltas": [
    {
      "metric": "map50",
      "legacy": 0.41,
      "framework": 0.36,
      "abs_delta": 0.05,
      "pct_delta": 12.2,
      "within_tolerance": false
    },
    {
      "metric": "total_detections",
      "legacy": 995,
      "framework": 982,
      "abs_delta": 13,
      "pct_delta": 1.3,
      "within_tolerance": true
    }
  ],
  "artifact_mismatches": [],
  "likely_causes": [
    "Framework run used a stricter defended output profile than legacy for this case."
  ]
}
